data,tags
He began to wish to know more of her%2c and as a step towards conversingwith her himself%2c attended to her conversation with others. His doing sodrew her notice. It was at Sir William Lucas's%2c where a large party wereassembled.,Pride and Prejudice by Jane Austen
"The baby grunted again, and Alice looked very anxiously into its face tosee what was the matter with it. There could be no doubt that it hada VERY turn-up nose, much more like a snout than a real nose; also itseyes were getting extremely small for a baby: altogether Alice did notlike the look of the thing at all. ‘But perhaps it was only sobbing,’she thought, and looked into its eyes again, to see if there were anytears.",Alice's Adventures in Wonderland by Lewis Carroll
Sir William only smiled. “Your friend performs delightfully%2c” hecontinued after a pause%2c on seeing Bingley join the group; “and I doubtnot that you are an adept in the science yourself%2c Mr. Darcy.”,Pride and Prejudice by Jane Austen
"‘You’ll get used to it in time,’ said the Caterpillar; and it put thehookah into its mouth and began smoking again.",Alice's Adventures in Wonderland by Lewis Carroll
"He got up from his chair and drew a large screen right in front of theportrait, shuddering as he glanced at it.  ""How horrible!"" he murmuredto himself, and he walked across to the window and opened it.  When hestepped out on to the grass, he drew a deep breath.  The fresh morningair seemed to drive away all his sombre passions.  He thought only ofSibyl.  A faint echo of his love came back to him.  He repeated hername over and over again.  The birds that were singing in thedew-drenched garden seemed to be telling the flowers about her.",The Picture of Dorian Gray by Oscar Wilde
The loose flesh of his neck shook like a cock’s wattles. Anillstarched dicky jutted up and with a rude gesture he thrust it backinto his waistcoat.,Ulysses by James Joyce
"Mr Bloom, glancing sideways up from the cross he had made, saw theforeman’s sallow face, think he has a touch of jaundice, and beyondthe obedient reels feeding in huge webs of paper. Clank it. Clankit. Miles of it unreeled. What becomes of it after? O, wrap up meat,parcels: various uses, thousand and one things.",Ulysses by James Joyce
"‘If you knew Time as well as I do,’ said the Hatter, ‘you wouldn’t talkabout wasting IT. It’s HIM.’",Alice's Adventures in Wonderland by Lewis Carroll
"Yet he was afraid.  Sometimes when he was down at his great house inNottinghamshire, entertaining the fashionable young men of his own rankwho were his chief companions, and astounding the county by the wantonluxury and gorgeous splendour of his mode of life, he would suddenlyleave his guests and rush back to town to see that the door had notbeen tampered with and that the picture was still there.  What if itshould be stolen?  The mere thought made him cold with horror.  Surelythe world would know his secret then.  Perhaps the world alreadysuspected it.",The Picture of Dorian Gray by Oscar Wilde
"  He ceased; then order'd for the sage's bed  A warmer couch with numerous carpets spread.  With that, stern Ajax his long silence broke,  And thus, impatient, to Ulysses spoke:",The Iliad by Homer
"I wish I had, for as sure as there is a God in heaven, if he ever doesyou any wrong, I shall kill him.",The Picture of Dorian Gray by Oscar Wilde
“With great energy; but it is always a subject which makes a ladyenergetic.”,Pride and Prejudice by Jane Austen
The priest and the massboy stood up and walked off. All over. The womenremained behind: thanksgiving.,Ulysses by James Joyce
"Jim frowned from time to time when he caught the inquisitive glance ofsome stranger.  He had that dislike of being stared at, which comes ongeniuses late in life and never leaves the commonplace.  Sibyl,however, was quite unconscious of the effect she was producing.  Herlove was trembling in laughter on her lips.  She was thinking of PrinceCharming, and, that she might think of him all the more, she did nottalk of him, but prattled on about the ship in which Jim was going tosail, about the gold he was certain to find, about the wonderfulheiress whose life he was to save from the wicked, red-shirtedbushrangers.  For he was not to remain a sailor, or a supercargo, orwhatever he was going to be.  Oh, no!  A sailor's existence wasdreadful.  Fancy being cooped up in a horrid ship, with the hoarse,hump-backed waves trying to get in, and a black wind blowing the mastsdown and tearing the sails into long screaming ribands!  He was toleave the vessel at Melbourne, bid a polite good-bye to the captain,and go off at once to the gold-fields. Before a week was over he was tocome across a large nugget of pure gold, the largest nugget that hadever been discovered, and bring it down to the coast in a waggonguarded by six mounted policemen.  The bushrangers were to attack themthree times, and be defeated with immense slaughter.  Or, no.  He wasnot to go to the gold-fields at all.  They were horrid places, wheremen got intoxicated, and shot each other in bar-rooms, and used badlanguage.  He was to be a nice sheep-farmer, and one evening, as he wasriding home, he was to see the beautiful heiress being carried off by arobber on a black horse, and give chase, and rescue her.  Of course,she would fall in love with him, and he with her, and they would getmarried, and come home, and live in an immense house in London.  Yes,there were delightful things in store for him.  But he must be verygood, and not lose his temper, or spend his money foolishly.  She wasonly a year older than he was, but she knew so much more of life.  Hemust be sure, also, to write to her by every mail, and to say hisprayers each night before he went to sleep.  God was very good, andwould watch over him.  She would pray for him, too, and in a few yearshe would come back quite rich and happy.",The Picture of Dorian Gray by Oscar Wilde
"‘It’s a Cheshire cat,’ said the Duchess, ‘and that’s why. Pig!’",Alice's Adventures in Wonderland by Lewis Carroll
"You will some day, surely?",The Picture of Dorian Gray by Oscar Wilde
—You like it? J. J. O’Molloy asked Stephen.,Ulysses by James Joyce
Can't you see your ideal in it? said Dorian bitterly.,The Picture of Dorian Gray by Oscar Wilde
"You will never marry again, Lady Narborough, broke in Lord Henry.""You were far too happy.  When a woman marries again, it is because shedetested her first husband.  When a man marries again, it is because headored his first wife.  Women try their luck; men risk theirs.""",The Picture of Dorian Gray by Oscar Wilde
"From this criticism, which shows as much insight into the depths of humannature as into the minute wire-drawings of scholastic investigation, letus pass on to the main question at issue. Was Homer an individual?(17) orwere the Iliad and Odyssey the result of an ingenious arrangement offragments by earlier poets?",The Iliad by Homer
"Basil, said the lad, going over to him and putting his hand on hisshoulder, ""you have come too late.  Yesterday, when I heard that SibylVane had killed herself--""",The Picture of Dorian Gray by Oscar Wilde
The lad muttered something to himself and drummed on the window-panewith his coarse fingers.  He had just turned round to say somethingwhen the door opened and Sibyl ran in.,The Picture of Dorian Gray by Oscar Wilde
See it in your face. See it in your eye. Lazy idle little schemer.,Ulysses by James Joyce
"Dear Lady Narborough, murmured Dorian, smiling, ""I have not been inlove for a whole week--not, in fact, since Madame de Ferrol left town.""",The Picture of Dorian Gray by Oscar Wilde
"Ah, Alan, murmured Dorian with a sigh, ""I wish you had a thousandthpart of the pity for me that I have for you."" He turned away as hespoke and stood looking out at the garden.  Campbell made no answer.",The Picture of Dorian Gray by Oscar Wilde
  So spake the imperial regent of the skies;  To whom the goddess with the azure eyes:,The Iliad by Homer
"This seemed to Alice a good opportunity for making her escape; so sheset off at once, and ran till she was quite tired and out of breath, andtill the puppy’s bark sounded quite faint in the distance.",Alice's Adventures in Wonderland by Lewis Carroll
"Dorian, Dorian, she cried, ""before I knew you, acting was the onereality of my life.  It was only in the theatre that I lived.  Ithought that it was all true.  I was Rosalind one night and Portia theother.  The joy of Beatrice was my joy, and the sorrows of Cordeliawere mine also.  I believed in everything.  The common people who actedwith me seemed to me to be godlike.  The painted scenes were my world.I knew nothing but shadows, and I thought them real.  You came--oh, mybeautiful love!--and you freed my soul from prison.  You taught me whatreality really is.  To-night, for the first time in my life, I sawthrough the hollowness, the sham, the silliness of the empty pageant inwhich I had always played.  To-night, for the first time, I becameconscious that the Romeo was hideous, and old, and painted, that themoonlight in the orchard was false, that the scenery was vulgar, andthat the words I had to speak were unreal, were not my words, were notwhat I wanted to say.  You had brought me something higher, somethingof which all art is but a reflection.  You had made me understand whatlove really is.  My love!  My love!  Prince Charming!  Prince of life!I have grown sick of shadows.  You are more to me than all art can everbe.  What have I to do with the puppets of a play?  When I came onto-night, I could not understand how it was that everything had gonefrom me.  I thought that I was going to be wonderful.  I found that Icould do nothing.  Suddenly it dawned on my soul what it all meant.The knowledge was exquisite to me.  I heard them hissing, and I smiled.What could they know of love such as ours?  Take me away, Dorian--takeme away with you, where we can be quite alone.  I hate the stage.  Imight mimic a passion that I do not feel, but I cannot mimic one thatburns me like fire.  Oh, Dorian, Dorian, you understand now what itsignifies?  Even if I could do it, it would be profanation for me toplay at being in love.  You have made me see that.""",The Picture of Dorian Gray by Oscar Wilde
"  Those, where fair Elis and Buprasium join;  Whom Hyrmin, here, and Myrsinus confine,  And bounded there, where o'er the valleys rose  The Olenian rock; and where Alisium flows;  Beneath four chiefs (a numerous army) came:  The strength and glory of the Epean name.  In separate squadrons these their train divide,  Each leads ten vessels through the yielding tide.  One was Amphimachus, and Thalpius one;  (Eurytus' this, and that Teatus' son;)  Diores sprung from Amarynceus' line;  And great Polyxenus, of force divine.",The Iliad by Homer
"My dear Basil, said Dorian, ""what have you told me?  Simply that youfelt that you admired me too much.  That is not even a compliment.""",The Picture of Dorian Gray by Oscar Wilde
"Good night, answered the young man, passing up the steps and wipinghis parched mouth with a handkerchief.",The Picture of Dorian Gray by Oscar Wilde
"‘So you did, old fellow!’ said the others.",Alice's Adventures in Wonderland by Lewis Carroll
"Half a century ago, the acute and valuable Prolegomena of F. A. Wolf,turning to account the Venetian Scholia, which had then been recentlypublished, first opened philosophical discussion as to the history of theHomeric text. A considerable part of that dissertation (though by no meansthe whole) is employed in vindicating the position, previously announcedby Bentley, amongst others, that the separate constituent portions of theIliad and Odyssey had not been cemented together into any compact body andunchangeable order, until the days of Peisistratus, in the sixth centurybefore Christ. As a step towards that conclusion, Wolf maintained that nowritten copies of either poem could be shown to have existed during theearlier times, to which their composition is referred; and that withoutwriting, neither the perfect symmetry of so complicated a work could havebeen originally conceived by any poet, nor, if realized by him,transmitted with assurance to posterity. The absence of easy andconvenient writing, such as must be indispensably supposed for longmanuscripts, among the early Greeks, was thus one of the points in Wolf'scase against the primitive integrity of the Iliad and Odyssey. By Nitzsch,and other leading opponents of Wolf, the connection of the one with theother seems to have been accepted as he originally put it; and it has beenconsidered incumbent on those who defended the ancient aggregate characterof the Iliad and Odyssey, to maintain that they were written poems fromthe beginning.
To me it appears, that the architectonic functions ascribed by Wolf toPeisistratus and his associates, in reference to the Homeric poems, arenowise admissible. But much would undoubtedly be gained towards that viewof the question, if it could be shown, that, in order to controvert it, wewere driven to the necessity of admitting long written poems, in the ninthcentury before the Christian aera. Few things, in my opinion, can be moreimprobable; and Mr. Payne Knight, opposed as he is to the Wolfianhypothesis, admits this no less than Wolf himself. The traces of writingin Greece, even in the seventh century before the Christian aera, areexceedingly trifling. We have no remaining inscription earlier than thefortieth Olympiad, and the early inscriptions are rude and unskilfullyexecuted; nor can we even assure ourselves whether Archilochus, Simonidesof Amorgus, Kallinus, Tyrtaeus, Xanthus, and the other early elegiac andlyric poets, committed their compositions to writing, or at what time thepractice of doing so became familiar. The first positive ground whichauthorizes us to presume the existence of a manuscript of Homer, is in thefamous ordinance of Solon, with regard to the rhapsodies at thePanathenaea: but for what length of time previously manuscripts hadexisted, we are unable to say.",The Iliad by Homer
I should have said when he clapped on his topper. Thank you. I oughtto have said something about an old hat or something. No. I could havesaid. Looks as good as new now. See his phiz then.,Ulysses by James Joyce
"Mr Power, collapsing in laughter, shaded his face from the window as thecarriage passed Gray’s statue.",Ulysses by James Joyce
"Nothing is ever quite true, said Lord Henry.",The Picture of Dorian Gray by Oscar Wilde
The telephone whirred inside.,Ulysses by James Joyce
"—The O’Connell circle, Mr Dedalus said about him.",Ulysses by James Joyce
"Don't run down dyed hair and painted faces.  There is an extraordinarycharm in them, sometimes, said Lord Henry.",The Picture of Dorian Gray by Oscar Wilde
"‘We called him Tortoise because he taught us,’ said the Mock Turtleangrily: ‘really you are very dull!’",Alice's Adventures in Wonderland by Lewis Carroll
"As soon as he had left, he rushed to the screen and drew it back.  No;there was no further change in the picture.  It had received the newsof Sibyl Vane's death before he had known of it himself.  It wasconscious of the events of life as they occurred.  The vicious crueltythat marred the fine lines of the mouth had, no doubt, appeared at thevery moment that the girl had drunk the poison, whatever it was.  Orwas it indifferent to results?  Did it merely take cognizance of whatpassed within the soul?  He wondered, and hoped that some day he wouldsee the change taking place before his very eyes, shuddering as hehoped it.",The Picture of Dorian Gray by Oscar Wilde
"It is a great loss to the poetical world that Mr. Dryden did not live totranslate the Iliad. He has left us only the first book, and a small partof the sixth; in which if he has in some places not truly interpreted thesense, or preserved the antiquities, it ought to be excused on account ofthe haste he was obliged to write in. He seems to have had too much regardto Chapman, whose words he sometimes copies, and has unhappily followedhim in passages where he wanders from the original. However, had hetranslated the whole work, I would no more have attempted Homer after himthan Virgil: his version of whom (notwithstanding some human errors) isthe most noble and spirited translation I know in any language. But thefate of great geniuses is like that of great ministers: though they areconfessedly the first in the commonwealth of letters, they must be enviedand calumniated only for being at the head of it.",The Iliad by Homer
"   ‘I have answered three questions, and that is enough,’    Said his father; ‘don’t give yourself airs!   Do you think I can listen all day to such stuff?    Be off, or I’ll kick you down stairs!’",Alice's Adventures in Wonderland by Lewis Carroll
"Here the Dormouse shook itself, and began singing in its sleep ‘Twinkle,twinkle, twinkle, twinkle--’ and went on so long that they had to pinchit to make it stop.",Alice's Adventures in Wonderland by Lewis Carroll
“I have no right to give _my_ opinion%2c” said Wickham%2c “as to his beingagreeable or otherwise. I am not qualified to form one. I have known himtoo long and too well to be a fair judge. It is impossible for _me_to be impartial. But I believe your opinion of him would in generalastonish--and perhaps you would not express it quite so stronglyanywhere else. Here you are in your own family.”,Pride and Prejudice by Jane Austen
"‘Ugh!’ said the Lory, with a shiver.",Alice's Adventures in Wonderland by Lewis Carroll
"He could hear nothing, but the drip, drip on the threadbare carpet.  Heopened the door and went out on the landing.  The house was absolutelyquiet.  No one was about.  For a few seconds he stood bending over thebalustrade and peering down into the black seething well of darkness.Then he took out the key and returned to the room, locking himself inas he did so.",The Picture of Dorian Gray by Oscar Wilde
"‘Come on, then!’ roared the Queen, and Alice joined the procession,wondering very much what would happen next.",Alice's Adventures in Wonderland by Lewis Carroll
“I did not know that you intended to walk%2c” said Miss Bingley%2c in someconfusion%2c lest they had been overheard.,Pride and Prejudice by Jane Austen
"Dorian half opened the door.  As he did so, he saw the face of hisportrait leering in the sunlight.  On the floor in front of it the torncurtain was lying.  He remembered that the night before he hadforgotten, for the first time in his life, to hide the fatal canvas,and was about to rush forward, when he drew back with a shudder.",The Picture of Dorian Gray by Oscar Wilde
"  As on some mountain, through the lofty grove,  The crackling flames ascend, and blaze above;  The fires expanding, as the winds arise,  Shoot their long beams, and kindle half the skies:  So from the polish'd arms, and brazen shields,  A gleamy splendour flash'd along the fields.  Not less their number than the embodied cranes,  Or milk-white swans in Asius' watery plains.  That, o'er the windings of Cayster's springs,(97)  Stretch their long necks, and clap their rustling wings,  Now tower aloft, and course in airy rounds,  Now light with noise; with noise the field resounds.  Thus numerous and confused, extending wide,  The legions crowd Scamander's flowery side;(98)  With rushing troops the plains are cover'd o'er,  And thundering footsteps shake the sounding shore.  Along the river's level meads they stand,  Thick as in spring the flowers adorn the land,  Or leaves the trees; or thick as insects play,  The wandering nation of a summer's day:  That, drawn by milky steams, at evening hours,  In gather'd swarms surround the rural bowers;  From pail to pail with busy murmur run  The gilded legions, glittering in the sun.  So throng'd, so close, the Grecian squadrons stood  In radiant arms, and thirst for Trojan blood.  Each leader now his scatter'd force conjoins  In close array, and forms the deepening lines.  Not with more ease the skilful shepherd-swain  Collects his flocks from thousands on the plain.  The king of kings, majestically tall,  Towers o'er his armies, and outshines them all;  Like some proud bull, that round the pastures leads  His subject herds, the monarch of the meads,  Great as the gods, the exalted chief was seen,  His strength like Neptune, and like Mars his mien;(99)  Jove o'er his eyes celestial glories spread,  And dawning conquest played around his head.",The Iliad by Homer
"—He’s pretty well on, professor MacHugh said in a low voice.",Ulysses by James Joyce
"Prince Charming, she answered, looking after the victoria.",The Picture of Dorian Gray by Oscar Wilde
Hell of a racket they make. He doesn’t hear it. Nannan. Iron nerves.Maybe he understands what I.,Ulysses by James Joyce
"‘Oh, I’m not particular as to size,’ Alice hastily replied; ‘only onedoesn’t like changing so often, you know.’",Alice's Adventures in Wonderland by Lewis Carroll
"Having now spoken of the beauties and defects of the original, it remainsto treat of the translation, with the same view to the chiefcharacteristic. As far as that is seen in the main parts of the poem, suchas the fable, manners, and sentiments, no translator can prejudice it butby wilful omissions or contractions. As it also breaks out in everyparticular image, description, and simile, whoever lessens or too muchsoftens those, takes off from this chief character. It is the first grandduty of an interpreter to give his author entire and unmaimed; and for therest, the diction and versification only are his proper province, sincethese must be his own, but the others he is to take as he finds them.",The Iliad by Homer
"     O, poor Robinson Crusoe!     How could you possibly do so?Poor Dignam! His last lie on the earth in his box. When you think ofthem all it does seem a waste of wood. All gnawed through. They couldinvent a handsome bier with a kind of panel sliding, let it down thatway. Ay but they might object to be buried out of another fellow’s.They’re so particular. Lay me in my native earth. Bit of clay fromthe holy land. Only a mother and deadborn child ever buried in the onecoffin. I see what it means. I see. To protect him as long as possibleeven in the earth. The Irishman’s house is his coffin. Embalming incatacombs, mummies the same idea.",Ulysses by James Joyce
"‘Just about as much right,’ said the Duchess, ‘as pigs have to fly; andthe m--’",Alice's Adventures in Wonderland by Lewis Carroll
"But there was no other place in the house so secure from prying eyes asthis.  He had the key, and no one else could enter it.  Beneath itspurple pall, the face painted on the canvas could grow bestial, sodden,and unclean.  What did it matter?  No one could see it.  He himselfwould not see it.  Why should he watch the hideous corruption of hissoul?  He kept his youth--that was enough.  And, besides, might nothis nature grow finer, after all?  There was no reason that the futureshould be so full of shame.  Some love might come across his life, andpurify him, and shield him from those sins that seemed to be alreadystirring in spirit and in flesh--those curious unpictured sins whosevery mystery lent them their subtlety and their charm.  Perhaps, someday, the cruel look would have passed away from the scarlet sensitivemouth, and he might show to the world Basil Hallward's masterpiece.",The Picture of Dorian Gray by Oscar Wilde
"Under the porch of the general post office shoeblacks called andpolished. Parked in North Prince’s street His Majesty’s vermilionmailcars, bearing on their sides the royal initials, E. R., receivedloudly flung sacks of letters, postcards, lettercards, parcels, insuredand paid, for local, provincial, British and overseas delivery.",Ulysses by James Joyce
"—O yes, J. J. O’Molloy said eagerly. Lady Dudley was walking homethrough the park to see all the trees that were blown down by thatcyclone last year and thought she’d buy a view of Dublin. And itturned out to be a commemoration postcard of Joe Brady or Number One orSkin-the-Goat. Right outside the viceregal lodge, imagine!",Ulysses by James Joyce
"—Yes, he was, he said, in Wisdom Hely’s. A traveller forblottingpaper.",Ulysses by James Joyce
I want you to beware of him.,The Picture of Dorian Gray by Oscar Wilde
In pompous nothings on his side%2c and civil assents on that of hiscousins%2c their time passed till they entered Meryton. The attention ofthe younger ones was then no longer to be gained by him. Their eyes wereimmediately wandering up in the street in quest of the officers%2c andnothing less than a very smart bonnet indeed%2c or a really new muslin ina shop window%2c could recall them.,Pride and Prejudice by Jane Austen
"I should not wonder if he was quite right there.  But, on the otherhand, judging from their appearance, most of them cannot be at allexpensive.",The Picture of Dorian Gray by Oscar Wilde
