data,tags
"  At this, the fairest of her sex obey'd,  And veil'd her blushes in a silken shade;  Unseen, and silent, from the train she moves,  Led by the goddess of the Smiles and Loves.  Arrived, and enter'd at the palace gate,  The maids officious round their mistress wait;  Then, all dispersing, various tasks attend;  The queen and goddess to the prince ascend.  Full in her Paris' sight, the queen of love  Had placed the beauteous progeny of Jove;  Where, as he view'd her charms, she turn'd away  Her glowing eyes, and thus began to say:",The Iliad by Homer
"Dunphy’s corner. Mourning coaches drawn up, drowning their grief. Apause by the wayside. Tiptop position for a pub. Expect we’ll pull uphere on the way back to drink his health. Pass round the consolation.Elixir of life.",Ulysses by James Joyce
"—I beg yours, he said.",Ulysses by James Joyce
"‘Really, now you ask me,’ said Alice, very much confused, ‘I don’tthink--’",Alice's Adventures in Wonderland by Lewis Carroll
"You are mad, Dorian.",The Picture of Dorian Gray by Oscar Wilde
“She did%2c indeed%2c Louisa. I could hardly keep my countenance. Verynonsensical to come at all! Why must _she_ be scampering about thecountry%2c because her sister had a cold? Her hair%2c so untidy%2c so blowsy!”,Pride and Prejudice by Jane Austen
About three weeks.,The Picture of Dorian Gray by Oscar Wilde
“About a month ago I received this letter; and about a fortnight agoI answered it%2c for I thought it a case of some delicacy%2c and requiringearly attention. It is from my cousin%2c Mr. Collins%2c who%2c when I am dead%2cmay turn you all out of this house as soon as he pleases.”,Pride and Prejudice by Jane Austen
"I am waiting, Basil, said the young man in a hard clear voice.",The Picture of Dorian Gray by Oscar Wilde
“No%2c no; stay where you are. You are charmingly grouped%2c and appearto uncommon advantage. The picturesque would be spoilt by admitting afourth. Good-bye.”,Pride and Prejudice by Jane Austen
“If I were as rich as Mr. Darcy%2c” cried a young Lucas%2c who came withhis sisters%2c “I should not care how proud I was. I would keep a pack offoxhounds%2c and drink a bottle of wine a day.”,Pride and Prejudice by Jane Austen
"For, while he fascinated many, there were not a few who distrusted him.He was very nearly blackballed at a West End club of which his birthand social position fully entitled him to become a member, and it wassaid that on one occasion, when he was brought by a friend into thesmoking-room of the Churchill, the Duke of Berwick and anothergentleman got up in a marked manner and went out.  Curious storiesbecame current about him after he had passed his twenty-fifth year.  Itwas rumoured that he had been seen brawling with foreign sailors in alow den in the distant parts of Whitechapel, and that he consorted withthieves and coiners and knew the mysteries of their trade.  Hisextraordinary absences became notorious, and, when he used to reappearagain in society, men would whisper to each other in corners, or passhim with a sneer, or look at him with cold searching eyes, as thoughthey were determined to discover his secret.",The Picture of Dorian Gray by Oscar Wilde
"To proceed to the allegorical fable--If we reflect upon those innumerableknowledges, those secrets of nature and physical philosophy which Homer isgenerally supposed to have wrapped up in his allegories, what a new andample scene of wonder may this consideration afford us! How fertile willthat imagination appear, which as able to clothe all the properties ofelements, the qualifications of the mind, the virtues and vices, in formsand persons, and to introduce them into actions agreeable to the nature ofthe things they shadowed! This is a field in which no succeeding poetscould dispute with Homer, and whatever commendations have been allowedthem on this head, are by no means for their invention in having enlargedhis circle, but for their judgment in having contracted it. For when themode of learning changed in the following ages, and science was deliveredin a plainer manner, it then became as reasonable in the more modern poetsto lay it aside, as it was in Homer to make use of it. And perhaps it wasno unhappy circumstance for Virgil, that there was not in his time thatdemand upon him of so great an invention as might be capable of furnishingall those allegorical parts of a poem.",The Iliad by Homer
"Richie Goulding and the legal bag. Goulding, Collis and Ward he callsthe firm. His jokes are getting a bit damp. Great card he was. Waltzingin Stamer street with Ignatius Gallaher on a Sunday morning, thelandlady’s two hats pinned on his head. Out on the rampage all night.Beginning to tell on him now: that backache of his, I fear. Wife ironinghis back. Thinks he’ll cure it with pills. All breadcrumbs they are.About six hundred per cent profit.",Ulysses by James Joyce
“This walk is not wide enough for our party. We had better go into theavenue.”,Pride and Prejudice by Jane Austen
"Too cold for Monsieur? asked his valet, putting an omelette on thetable.  ""I shut the window?""",The Picture of Dorian Gray by Oscar Wilde
“About a month%2c” said Elizabeth; and then%2c unwilling to let the subjectdrop%2c added%2c “He is a man of very large property in Derbyshire%2c Iunderstand.”,Pride and Prejudice by Jane Austen
"—Down with his aunt Sally, I suppose, Mr Dedalus said, the Gouldingfaction, the drunken little costdrawer and Crissie, papa’s little lumpof dung, the wise child that knows her own father.",Ulysses by James Joyce
"As soon as he was alone, he lit a cigarette and began sketching upon apiece of paper, drawing first flowers and bits of architecture, andthen human faces.  Suddenly he remarked that every face that he drewseemed to have a fantastic likeness to Basil Hallward.  He frowned, andgetting up, went over to the book-case and took out a volume at hazard.He was determined that he would not think about what had happened untilit became absolutely necessary that he should do so.",The Picture of Dorian Gray by Oscar Wilde
"‘That WAS a narrow escape!’ said Alice, a good deal frightened at thesudden change, but very glad to find herself still in existence; ‘andnow for the garden!’ and she ran with all speed back to the little door:but, alas! the little door was shut again, and the little golden key waslying on the glass table as before, ‘and things are worse than ever,’thought the poor child, ‘for I never was so small as this before, never!And I declare it’s too bad, that it is!’",Alice's Adventures in Wonderland by Lewis Carroll
"       [later editions continued as follows  When the sands are all dry, he is gay as a lark,  And will talk in contemptuous tones of the Shark,  But, when the tide rises and sharks are around,  His voice has a timid and tremulous sound.]",Alice's Adventures in Wonderland by Lewis Carroll
"In all these objections we see nothing that contradicts his title to thehonour of the chief invention: and as long as this (which is indeed thecharacteristic of poetry itself) remains unequalled by his followers, hestill continues superior to them. A cooler judgment may commit fewerfaults, and be more approved in the eyes of one sort of critics: but thatwarmth of fancy will carry the loudest and most universal applauses whichholds the heart of a reader under the strongest enchantment. Homer notonly appears the inventor of poetry, but excels all the inventors of otherarts, in this, that he has swallowed up the honour of those who succeededhim. What he has done admitted no increase, it only left room forcontraction or regulation. He showed all the stretch of fancy at once; andif he has failed in some of his flights, it was but because he attemptedeverything. A work of this kind seems like a mighty tree, which rises fromthe most vigorous seed, is improved with industry, flourishes, andproduces the finest fruit: nature and art conspire to raise it; pleasureand profit join to make it valuable: and they who find the justest faults,have only said that a few branches which run luxuriant through a richnessof nature, might be lopped into form to give it a more regular appearance.",The Iliad by Homer
‘With extras?’ asked the Mock Turtle a little anxiously.,Alice's Adventures in Wonderland by Lewis Carroll
"‘Oh, there’s no use in talking to him,’ said Alice desperately: ‘he’sperfectly idiotic!’ And she opened the door and went in.",Alice's Adventures in Wonderland by Lewis Carroll
He turned towards Myles Crawford and said:,Ulysses by James Joyce
"There was nothing evil in it, nothing shameful.  You were to me suchan ideal as I shall never meet again.  This is the face of a satyr.",The Picture of Dorian Gray by Oscar Wilde
"‘Of course it was,’ said the Mock Turtle.",Alice's Adventures in Wonderland by Lewis Carroll
"‘No, I give it up,’ Alice replied: ‘what’s the answer?’",Alice's Adventures in Wonderland by Lewis Carroll
They bent their silk hats in concert and Hynes inclined his ear. Thecaretaker hung his thumbs in the loops of his gold watchchain and spokein a discreet tone to their vacant smiles.,Ulysses by James Joyce
"She will never come to life again now, muttered the lad, burying hisface in his hands.",The Picture of Dorian Gray by Oscar Wilde
“Have you anything else to propose for my domestic felicity?”,Pride and Prejudice by Jane Austen
"Society! muttered the lad.  ""I don't want to know anything aboutthat.  I should like to make some money to take you and Sibyl off thestage.  I hate it.""",The Picture of Dorian Gray by Oscar Wilde
"It was some consolation that Harry was to be there, and when the dooropened and he heard his slow musical voice lending charm to someinsincere apology, he ceased to feel bored.",The Picture of Dorian Gray by Oscar Wilde
"That evening, at eight-thirty, exquisitely dressed and wearing a largebutton-hole of Parma violets, Dorian Gray was ushered into LadyNarborough's drawing-room by bowing servants.  His forehead wasthrobbing with maddened nerves, and he felt wildly excited, but hismanner as he bent over his hostess's hand was as easy and graceful asever.  Perhaps one never seems so much at one's ease as when one has toplay a part.  Certainly no one looking at Dorian Gray that night couldhave believed that he had passed through a tragedy as horrible as anytragedy of our age.  Those finely shaped fingers could never haveclutched a knife for sin, nor those smiling lips have cried out on Godand goodness.  He himself could not help wondering at the calm of hisdemeanour, and for a moment felt keenly the terrible pleasure of adouble life.",The Picture of Dorian Gray by Oscar Wilde
"She had not gone much farther before she came in sight of the houseof the March Hare: she thought it must be the right house, because thechimneys were shaped like ears and the roof was thatched with fur. Itwas so large a house, that she did not like to go nearer till she hadnibbled some more of the lefthand bit of mushroom, and raised herself toabout two feet high: even then she walked up towards it rather timidly,saying to herself ‘Suppose it should be raving mad after all! I almostwish I’d gone to see the Hatter instead!’",Alice's Adventures in Wonderland by Lewis Carroll
"The carriage heeled over and back, their four trunks swaying.",Ulysses by James Joyce
—What is it?,Ulysses by James Joyce
"Of course, with their ages, slightly edited.  But nothing must be donein a hurry.  I want it to be what _The Morning Post_ calls a suitablealliance, and I want you both to be happy.",The Picture of Dorian Gray by Oscar Wilde
What do you want me to say?,The Picture of Dorian Gray by Oscar Wilde
"Here is a sovereign for you, said Dorian.  ""You shall have another ifyou drive fast.""",The Picture of Dorian Gray by Oscar Wilde
‘Certainly not!’ said Alice indignantly.,Alice's Adventures in Wonderland by Lewis Carroll
  He spoke; and furious hurl'd against the ground  His sceptre starr'd with golden studs around:  Then sternly silent sat. With like disdain  The raging king return'd his frowns again.,The Iliad by Homer
—I was in mortal agony with you talking of suicide before Bloom.,Ulysses by James Joyce
"Yes; I don't suppose you will object to that.  Georges Petit is goingto collect all my best pictures for a special exhibition in the Rue deSeze, which will open the first week in October.  The portrait willonly be away a month.  I should think you could easily spare it forthat time.  In fact, you are sure to be out of town.  And if you keepit always behind a screen, you can't care much about it.",The Picture of Dorian Gray by Oscar Wilde
"‘THAT you won’t’ thought Alice, and, after waiting till she fanciedshe heard the Rabbit just under the window, she suddenly spread out herhand, and made a snatch in the air. She did not get hold of anything,but she heard a little shriek and a fall, and a crash of broken glass,from which she concluded that it was just possible it had fallen into acucumber-frame, or something of the sort.",Alice's Adventures in Wonderland by Lewis Carroll
Speaking about me. What did he say? What did he say? What did he sayabout me? Don’t ask.,Ulysses by James Joyce
He strode away from them towards the window.,Ulysses by James Joyce
“Nay%2c if you are serious about it%2c I shall consider the matter isabsolutely settled. You will be having a charming mother-in-law%2c indeed;and%2c of course%2c she will always be at Pemberley with you.”,Pride and Prejudice by Jane Austen
“But%2c my dear%2c your father cannot spare the horses%2c I am sure. They arewanted in the farm%2c Mr. Bennet%2c are they not?”,Pride and Prejudice by Jane Austen
"Just then her head struck against the roof of the hall: in fact she wasnow more than nine feet high, and she at once took up the little goldenkey and hurried off to the garden door.",Alice's Adventures in Wonderland by Lewis Carroll
"I am delighted, he answered, smiling.  Then he added, somewhatharshly, ""You are the one man in the world who is entitled to knoweverything about me.  You have had more to do with my life than youthink""; and, taking up the lamp, he opened the door and went in.  Acold current of air passed them, and the light shot up for a moment ina flame of murky orange.  He shuddered.  ""Shut the door behind you,"" hewhispered, as he placed the lamp on the table.",The Picture of Dorian Gray by Oscar Wilde
"I hope the girl is good, Harry.  I don't want to see Dorian tied tosome vile creature, who might degrade his nature and ruin hisintellect.",The Picture of Dorian Gray by Oscar Wilde
At his armpit Bantam Lyons’ voice and hand said:,Ulysses by James Joyce
"‘Well, be off, then!’ said the Pigeon in a sulky tone, as it settleddown again into its nest. Alice crouched down among the trees as well asshe could, for her neck kept getting entangled among the branches, andevery now and then she had to stop and untwist it. After a while sheremembered that she still held the pieces of mushroom in her hands, andshe set to work very carefully, nibbling first at one and then at theother, and growing sometimes taller and sometimes shorter, until she hadsucceeded in bringing herself down to her usual height.",Alice's Adventures in Wonderland by Lewis Carroll
"‘I thought you did,’ said the Mouse. ‘--I proceed. “Edwin and Morcar,the earls of Mercia and Northumbria, declared for him: and even Stigand,the patriotic archbishop of Canterbury, found it advisable--“’",Alice's Adventures in Wonderland by Lewis Carroll
"‘It turned into a pig,’ Alice quietly said, just as if it had come backin a natural way.",Alice's Adventures in Wonderland by Lewis Carroll
"  ""Great king of nations! (Ithacus replied)  Fix'd is his wrath, unconquer'd is his pride;  He slights thy friendship, thy proposals scorns,  And, thus implored, with fiercer fury burns.  To save our army, and our fleets to free,  Is not his care; but left to Greece and thee.  Your eyes shall view, when morning paints the sky,  Beneath his oars the whitening billows fly;  Us too he bids our oars and sails employ,  Nor hope the fall of heaven-protected Troy;  For Jove o'ershades her with his arm divine,  Inspires her war, and bids her glory shine.  Such was his word: what further he declared,  These sacred heralds and great Ajax heard.  But Phoenix in his tent the chief retains,  Safe to transport him to his native plains  When morning dawns; if other he decree,  His age is sacred, and his choice is free.""",The Iliad by Homer
To see him is to worship him; to know him is to trust him.,The Picture of Dorian Gray by Oscar Wilde
"‘I never thought about it,’ said Alice. ‘Why?’",Alice's Adventures in Wonderland by Lewis Carroll
"  ""Why leave we not the fatal Trojan shore,  And measure back the seas we cross'd before?  The plague destroying whom the sword would spare,  'Tis time to save the few remains of war.  But let some prophet, or some sacred sage,  Explore the cause of great Apollo's rage;  Or learn the wasteful vengeance to remove  By mystic dreams, for dreams descend from Jove.(53)  If broken vows this heavy curse have laid,  Let altars smoke, and hecatombs be paid.  So Heaven, atoned, shall dying Greece restore,  And Phoebus dart his burning shafts no more.""",The Iliad by Homer
"—Of course, if he wants a par, Red Murray said earnestly, a pen behindhis ear, we can do him one.",Ulysses by James Joyce
‘Not I!’ said the Lory hastily.,Alice's Adventures in Wonderland by Lewis Carroll
"The following passage betrays the same tendency to connect the personagesof the poems with the history of the poet, which has already beenmentioned:--",The Iliad by Homer
Perhaps.,The Picture of Dorian Gray by Oscar Wilde
"It seems here of chief importance to expect no more than the nature ofthings makes possible. If the period of tradition in history is the regionof twilight, we should not expect in it perfect light. The creations ofgenius always seem like miracles, because they are, for the most part,created far out of the reach of observation. If we were in possession ofall the historical testimonies, we never could wholly explain the originof the Iliad and the Odyssey; for their origin, in all essential points,must have remained the secret of the poet. (16)",The Iliad by Homer
“You write uncommonly fast.”,Pride and Prejudice by Jane Austen
"What was that loathsome red dew that gleamed, wet and glistening, onone of the hands, as though the canvas had sweated blood?  How horribleit was!--more horrible, it seemed to him for the moment, than thesilent thing that he knew was stretched across the table, the thingwhose grotesque misshapen shadow on the spotted carpet showed him thatit had not stirred, but was still there, as he had left it.",The Picture of Dorian Gray by Oscar Wilde
Saluting Ned Lambert and John Henry Menton he walked on at MartinCunningham’s side puzzling two long keys at his back.,Ulysses by James Joyce
Bantam Lyons raised his eyes suddenly and leered weakly.,Ulysses by James Joyce
"Killed herself!  Good heavens! is there no doubt about that? criedHallward, looking up at him with an expression of horror.",The Picture of Dorian Gray by Oscar Wilde
"I know that look.  It depresses me, murmured Lord Henry, examininghis rings.",The Picture of Dorian Gray by Oscar Wilde
"—Look at here, he said turning. The New York World cabled for aspecial. Remember that time?",Ulysses by James Joyce
"—Come on then, Myles Crawford said. Where’s my hat?",Ulysses by James Joyce
"—We were only thinking about it, Stephen said.",Ulysses by James Joyce
"  ""Ye gods! what wonders has Ulysses wrought!  What fruits his conduct and his courage yield!  Great in the council, glorious in the field.  Generous he rises in the crown's defence,  To curb the factious tongue of insolence,  Such just examples on offenders shown,  Sedition silence, and assert the throne.""",The Iliad by Homer
"  From Meges' force the swift Pedaeus fled,  Antenor's offspring from a foreign bed,  Whose generous spouse, Theanor, heavenly fair,  Nursed the young stranger with a mother's care.  How vain those cares! when Meges in the rear  Full in his nape infix'd the fatal spear;  Swift through his crackling jaws the weapon glides,  And the cold tongue and grinning teeth divides.",The Iliad by Homer
"Which brought them back again to the beginning of the conversation.Alice felt a little irritated at the Caterpillar’s making such VERYshort remarks, and she drew herself up and said, very gravely, ‘I think,you ought to tell me who YOU are, first.’",Alice's Adventures in Wonderland by Lewis Carroll
In another minute%2c Mr. Bingley%2c but without seeming to have noticed whatpassed%2c took leave and rode on with his friend.,Pride and Prejudice by Jane Austen
"  Then with a voice that shook the vaulted skies,  The king insults the goddess as she flies:  ""Ill with Jove's daughter bloody fights agree,  The field of combat is no scene for thee:  Go, let thy own soft sex employ thy care,  Go, lull the coward, or delude the fair.  Taught by this stroke renounce the war's alarms,  And learn to tremble at the name of arms.""",The Iliad by Homer
"And here is the key, sir, said the old lady, going over the contentsof her bunch with tremulously uncertain hands.  ""Here is the key.  I'llhave it off the bunch in a moment.  But you don't think of living upthere, sir, and you so comfortable here?""",The Picture of Dorian Gray by Oscar Wilde
"—Peaks, Ned Lambert went on, towering high on high, to bathe oursouls, as it were...",Ulysses by James Joyce
—Is it his speech last night? Mr Bloom asked.,Ulysses by James Joyce
"For some reason or other, the house was crowded that night, and the fatJew manager who met them at the door was beaming from ear to ear withan oily tremulous smile.  He escorted them to their box with a sort ofpompous humility, waving his fat jewelled hands and talking at the topof his voice.  Dorian Gray loathed him more than ever.  He felt as ifhe had come to look for Miranda and had been met by Caliban.  LordHenry, upon the other hand, rather liked him.  At least he declared hedid, and insisted on shaking him by the hand and assuring him that hewas proud to meet a man who had discovered a real genius and gonebankrupt over a poet.  Hallward amused himself with watching the facesin the pit.  The heat was terribly oppressive, and the huge sunlightflamed like a monstrous dahlia with petals of yellow fire.  The youthsin the gallery had taken off their coats and waistcoats and hung themover the side.  They talked to each other across the theatre and sharedtheir oranges with the tawdry girls who sat beside them.  Some womenwere laughing in the pit.  Their voices were horribly shrill anddiscordant.  The sound of the popping of corks came from the bar.",The Picture of Dorian Gray by Oscar Wilde
—Doughy Daw! he cried.,Ulysses by James Joyce
“Oh! it is of no consequence. I shall see her in January. But do youalways write such charming long letters to her%2c Mr. Darcy?”,Pride and Prejudice by Jane Austen
"Burying him. We come to bury Cæsar. His ides of March or June. Hedoesn’t know who is here nor care. Now who is that lankylooking galootover there in the macintosh? Now who is he I’d like to know? NowI’d give a trifle to know who he is. Always someone turns up you neverdreamt of. A fellow could live on his lonesome all his life. Yes, hecould. Still he’d have to get someone to sod him after he died thoughhe could dig his own grave. We all do. Only man buries. No, ants too.First thing strikes anybody. Bury the dead. Say Robinson Crusoe was trueto life. Well then Friday buried him. Every Friday buries a Thursday ifyou come to look at it.",Ulysses by James Joyce
"—Let us, Mr Power said.",Ulysses by James Joyce
“Yes%2c she called yesterday with her father. What an agreeable man SirWilliam is%2c Mr. Bingley%2c is not he? So much the man of fashion! Sogenteel and easy! He has always something to say to everybody. _That_is my idea of good breeding; and those persons who fancy themselves veryimportant%2c and never open their mouths%2c quite mistake the matter.”,Pride and Prejudice by Jane Austen
"Dorian, this is horrible!  Something has changed you completely.  Youlook exactly the same wonderful boy who, day after day, used to comedown to my studio to sit for his picture.  But you were simple,natural, and affectionate then.  You were the most unspoiled creaturein the whole world.  Now, I don't know what has come over you.  Youtalk as if you had no heart, no pity in you.  It is all Harry'sinfluence.  I see that.",The Picture of Dorian Gray by Oscar Wilde
But when the gentlemen entered%2c Jane was no longer the first object;Miss Bingley's eyes were instantly turned toward Darcy%2c and she hadsomething to say to him before he had advanced many steps. He addressedhimself to Miss Bennet%2c with a polite congratulation; Mr. Hurst alsomade her a slight bow%2c and said he was “very glad;” but diffusenessand warmth remained for Bingley's salutation. He was full of joy andattention. The first half-hour was spent in piling up the fire%2c lest sheshould suffer from the change of room; and she removed at his desireto the other side of the fireplace%2c that she might be further fromthe door. He then sat down by her%2c and talked scarcely to anyoneelse. Elizabeth%2c at work in the opposite corner%2c saw it all with greatdelight.,Pride and Prejudice by Jane Austen
"‘I don’t like the look of it at all,’ said the King: ‘however, it maykiss my hand if it likes.’",Alice's Adventures in Wonderland by Lewis Carroll
