data,tags
"  Meantime to beauteous Helen, from the skies  The various goddess of the rainbow flies:  (Like fair Laodice in form and face,  The loveliest nymph of Priam's royal race:)  Her in the palace, at her loom she found;  The golden web her own sad story crown'd,  The Trojan wars she weaved (herself the prize)  And the dire triumphs of her fatal eyes.  To whom the goddess of the painted bow:  ""Approach, and view the wondrous scene below!(112)  Each hardy Greek, and valiant Trojan knight,  So dreadful late, and furious for the fight,  Now rest their spears, or lean upon their shields;  Ceased is the war, and silent all the fields.  Paris alone and Sparta's king advance,  In single fight to toss the beamy lance;  Each met in arms, the fate of combat tries,  Thy love the motive, and thy charms the prize.""",The Iliad by Homer
Have you good artists?,Ulysses by James Joyce
"Well, sir, you'll be covered with cobwebs if you go into it.  Why, ithasn't been opened for nearly five years--not since his lordship died.",The Picture of Dorian Gray by Oscar Wilde
—Reuben J and the son were piking it down the quay next the river ontheir way to the Isle of Man boat and the young chiseller suddenly gotloose and over the wall with him into the Liffey.,Ulysses by James Joyce
"They went out into the flickering, wind-blown sunlight and strolleddown the dreary Euston Road.  The passersby glanced in wonder at thesullen heavy youth who, in coarse, ill-fitting clothes, was in thecompany of such a graceful, refined-looking girl.  He was like a commongardener walking with a rose.",The Picture of Dorian Gray by Oscar Wilde
"Come, Alan, you must decide at once.",The Picture of Dorian Gray by Oscar Wilde
How do you mean?,The Picture of Dorian Gray by Oscar Wilde
"  He said: a leader's and a brother's fears  Possess his soul, which thus the Spartan cheers:  ""Let not thy words the warmth of Greece abate;  The feeble dart is guiltless of my fate:  Stiff with the rich embroider'd work around,  My varied belt repell'd the flying wound.""",The Iliad by Homer
"‘Then it doesn’t matter which way you go,’ said the Cat.",Alice's Adventures in Wonderland by Lewis Carroll
"  ""Ye kings and warriors! may your vows be crown'd,  And Troy's proud walls lie level with the ground.  May Jove restore you when your toils are o'er  Safe to the pleasures of your native shore.  But, oh! relieve a wretched parent's pain,  And give Chryseis to these arms again;  If mercy fail, yet let my presents move,  And dread avenging Phoebus, son of Jove.""",The Iliad by Homer
Slipping his words deftly into the pauses of the clanking he drewswiftly on the scarred woodwork.,Ulysses by James Joyce
"—They were nature’s gentlemen, J. J. O’Molloy murmured. But wehave also Roman law.",Ulysses by James Joyce
"  Great Hector saw, and, raging at the view,  Pours on the Greeks: the Trojan troops pursue:  He fires his host with animating cries,  And brings along the furies of the skies,  Mars, stern destroyer! and Bellona dread,  Flame in the front, and thunder at their head:  This swells the tumult and the rage of fight;  That shakes a spear that casts a dreadful light.  Where Hector march'd, the god of battles shined,  Now storm'd before him, and now raged behind.",The Iliad by Homer
       ‘Wow! wow! wow!’,Alice's Adventures in Wonderland by Lewis Carroll
"—Sad, Martin Cunningham said. A child.",Ulysses by James Joyce
"I suppose it would, muttered the lad, walking up and down the roomand looking horribly pale.  ""But I thought it was my duty.  It is notmy fault that this terrible tragedy has prevented my doing what wasright.  I remember your saying once that there is a fatality about goodresolutions--that they are always made too late.  Mine certainly were.""",The Picture of Dorian Gray by Oscar Wilde
"Well, Dorian, he said at length, with a sad smile, ""I won't speak toyou again about this horrible thing, after to-day.  I only trust yourname won't be mentioned in connection with it.  The inquest is to takeplace this afternoon.  Have they summoned you?""",The Picture of Dorian Gray by Oscar Wilde
"As the chime struck one, Campbell turned round, and looking at DorianGray, saw that his eyes were filled with tears.  There was something inthe purity and refinement of that sad face that seemed to enrage him.""You are infamous, absolutely infamous!"" he muttered.",The Picture of Dorian Gray by Oscar Wilde
“Your examination of Mr. Darcy is over%2c I presume%2c” said Miss Bingley;“and pray what is the result?”,Pride and Prejudice by Jane Austen
"Mr Dedalus, staring from the empty fireplace at Ned Lambert’s quizzingface, asked of it sourly:",Ulysses by James Joyce
"—Excuse me, J. J. O’Molloy said, entering.",Ulysses by James Joyce
"—No, Mr Bloom began, turning and stopping. I say, Hynes!",Ulysses by James Joyce
“I have often observed how little young ladies are interested by booksof a serious stamp%2c though written solely for their benefit. It amazesme%2c I confess; for%2c certainly%2c there can be nothing so advantageous tothem as instruction. But I will no longer importune my young cousin.”,Pride and Prejudice by Jane Austen
"  While these appear before the power with prayers,  Hector to Paris' lofty dome repairs.(175)  Himself the mansion raised, from every part  Assembling architects of matchless art.  Near Priam's court and Hector's palace stands  The pompous structure, and the town commands.  A spear the hero bore of wondrous strength,  Of full ten cubits was the lance's length,  The steely point with golden ringlets join'd,  Before him brandish'd, at each motion shined  Thus entering, in the glittering rooms he found  His brother-chief, whose useless arms lay round,  His eyes delighting with their splendid show,  Brightening the shield, and polishing the bow.  Beside him Helen with her virgins stands,  Guides their rich labours, and instructs their hands.",The Iliad by Homer
"Dorian smiled and shook his head:  ""I am afraid I don't think so, LadyHenry.  I never talk during music--at least, during good music.  If onehears bad music, it is one's duty to drown it in conversation.""",The Picture of Dorian Gray by Oscar Wilde
"Horribly! he answered, gazing at her in amazement.  ""Horribly!  Itwas dreadful.  Are you ill?  You have no idea what it was.  You have noidea what I suffered.""",The Picture of Dorian Gray by Oscar Wilde
—Begone! he said. The world is before you.,Ulysses by James Joyce
"Lord Henry walked across the room, and sitting down by Dorian Gray,took both his hands in his own and held them tightly.  ""Dorian,"" hesaid, ""my letter--don't be frightened--was to tell you that Sibyl Vaneis dead.""",The Picture of Dorian Gray by Oscar Wilde
"What other cavils have been raised against Homer, are such as hardlydeserve a reply, but will yet be taken notice of as they occur in thecourse of the work. Many have been occasioned by an injudicious endeavourto exalt Virgil; which is much the same, as if one should think to raisethe superstructure by undermining the foundation: one would imagine, bythe whole course of their parallels, that these critics never so much asheard of Homer's having written first; a consideration which whoevercompares these two poets ought to have always in his eye. Some accuse himfor the same things which they overlook or praise in the other; as whenthey prefer the fable and moral of the Ćneis to those of the Iliad, forthe same reasons which might set the Odyssey above the Ćneis; as that thehero is a wiser man, and the action of the one more beneficial to hiscountry than that of the other; or else they blame him for not doing whathe never designed; as because Achilles is not as good and perfect a princeas Ćneas, when the very moral of his poem required a contrary character:it is thus that Rapin judges in his comparison of Homer and Virgil. Othersselect those particular passages of Homer which are not so laboured assome that Virgil drew out of them: this is the whole management ofScaliger in his Poetics. Others quarrel with what they take for low andmean expressions, sometimes through a false delicacy and refinement,oftener from an ignorance of the graces of the original, and then triumphin the awkwardness of their own translations: this is the conduct ofPerrault in his Parallels. Lastly, there are others, who, pretending to afairer proceeding, distinguish between the personal merit of Homer, andthat of his work; but when they come to assign the causes of the greatreputation of the Iliad, they found it upon the ignorance of his times,and the prejudice of those that followed: and in pursuance of thisprinciple, they make those accidents (such as the contention of thecities, &c.) to be the causes of his fame, which were in reality theconsequences of his merit. The same might as well be said of Virgil, orany great author whose general character will infallibly raise many casualadditions to their reputation. This is the method of Mons. de la Mott; whoyet confesses upon the whole that in whatever age Homer had lived, he musthave been the greatest poet of his nation, and that he may be said in hissense to be the master even of those who surpassed him.(39)",The Iliad by Homer
I shudder at the thought of being free.,The Picture of Dorian Gray by Oscar Wilde
"He extended elocutionary arms from frayed stained shirtcuffs, pausing:",Ulysses by James Joyce
"I wish it were _fin du globe_, said Dorian with a sigh.  ""Life is agreat disappointment.""",The Picture of Dorian Gray by Oscar Wilde
“Upon my word%2c Caroline%2c I should think it more possible to getPemberley by purchase than by imitation.”,Pride and Prejudice by Jane Austen
The first battle continues through this book. The scene is the same as inthe former.,The Iliad by Homer
During dinner%2c Mr. Bennet scarcely spoke at all; but when the servantswere withdrawn%2c he thought it time to have some conversation with hisguest%2c and therefore started a subject in which he expected him toshine%2c by observing that he seemed very fortunate in his patroness. LadyCatherine de Bourgh's attention to his wishes%2c and consideration forhis comfort%2c appeared very remarkable. Mr. Bennet could not have chosenbetter. Mr. Collins was eloquent in her praise. The subject elevated himto more than usual solemnity of manner%2c and with a most important aspecthe protested that “he had never in his life witnessed such behaviour ina person of rank--such affability and condescension%2c as he had himselfexperienced from Lady Catherine. She had been graciously pleased toapprove of both of the discourses which he had already had the honour ofpreaching before her. She had also asked him twice to dine at Rosings%2cand had sent for him only the Saturday before%2c to make up her pool ofquadrille in the evening. Lady Catherine was reckoned proud by manypeople he knew%2c but _he_ had never seen anything but affability in her.She had always spoken to him as she would to any other gentleman; shemade not the smallest objection to his joining in the society of theneighbourhood nor to his leaving the parish occasionally for a week ortwo%2c to visit his relations. She had even condescended to advise him tomarry as soon as he could%2c provided he chose with discretion; and hadonce paid him a visit in his humble parsonage%2c where she had perfectlyapproved all the alterations he had been making%2c and had even vouchsafedto suggest some herself--some shelves in the closet up stairs.”,Pride and Prejudice by Jane Austen
"So she swallowed one of the cakes, and was delighted to find that shebegan shrinking directly. As soon as she was small enough to get throughthe door, she ran out of the house, and found quite a crowd of littleanimals and birds waiting outside. The poor little Lizard, Bill, wasin the middle, being held up by two guinea-pigs, who were giving itsomething out of a bottle. They all made a rush at Alice the moment sheappeared; but she ran off as hard as she could, and soon found herselfsafe in a thick wood.",Alice's Adventures in Wonderland by Lewis Carroll
Mr. Wickham did not play at whist%2c and with ready delight was hereceived at the other table between Elizabeth and Lydia. At first thereseemed danger of Lydia's engrossing him entirely%2c for she was a mostdetermined talker; but being likewise extremely fond of lottery tickets%2cshe soon grew too much interested in the game%2c too eager in making betsand exclaiming after prizes to have attention for anyone in particular.Allowing for the common demands of the game%2c Mr. Wickham was thereforeat leisure to talk to Elizabeth%2c and she was very willing to hearhim%2c though what she chiefly wished to hear she could not hope to betold--the history of his acquaintance with Mr. Darcy. She dared noteven mention that gentleman. Her curiosity%2c however%2c was unexpectedlyrelieved. Mr. Wickham began the subject himself. He inquired how farNetherfield was from Meryton; and%2c after receiving her answer%2c asked ina hesitating manner how long Mr. Darcy had been staying there.,Pride and Prejudice by Jane Austen
—Who is that?,Ulysses by James Joyce
"‘Oh! So Bill’s got to come down the chimney, has he?’ said Alice toherself. ‘Shy, they seem to put everything upon Bill! I wouldn’t be inBill’s place for a good deal: this fireplace is narrow, to be sure; butI THINK I can kick a little!’",Alice's Adventures in Wonderland by Lewis Carroll
They drove on past Brian Boroimhe house. Near it now.,Ulysses by James Joyce
"  To him Tydides thus: ""My friend, forbear;  Suppress thy passion, and the king revere:  His high concern may well excuse this rage,  Whose cause we follow, and whose war we wage:  His the first praise, were Ilion's towers o'erthrown,  And, if we fail, the chief disgrace his own.  Let him the Greeks to hardy toils excite,  'Tis ours to labour in the glorious fight.""",The Iliad by Homer
"He looked down at the boots he had blacked and polished. She hadoutlived him. Lost her husband. More dead for her than for me. One mustoutlive the other. Wise men say. There are more women than men in theworld. Condole with her. Your terrible loss. I hope you’ll soon followhim. For Hindu widows only. She would marry another. Him? No. Yet whoknows after. Widowhood not the thing since the old queen died. Drawn ona guncarriage. Victoria and Albert. Frogmore memorial mourning. Butin the end she put a few violets in her bonnet. Vain in her heart ofhearts. All for a shadow. Consort not even a king. Her son was thesubstance. Something new to hope for not like the past she wanted back,waiting. It never comes. One must go first: alone, under the ground: andlie no more in her warm bed.",Ulysses by James Joyce
"‘Yes, that’s it,’ said the Hatter with a sigh: ‘it’s always tea-time,and we’ve no time to wash the things between whiles.’",Alice's Adventures in Wonderland by Lewis Carroll
“No%2c indeed%2c I did not. I knew nothing at all of Lady Catherine'sconnections. I never heard of her existence till the day beforeyesterday.”,Pride and Prejudice by Jane Austen
"I had intended never to enter your house again, Gray.  But you said itwas a matter of life and death.  His voice was hard and cold.  Hespoke with slow deliberation.  There was a look of contempt in thesteady searching gaze that he turned on Dorian.  He kept his hands inthe pockets of his Astrakhan coat, and seemed not to have noticed thegesture with which he had been greeted.",The Picture of Dorian Gray by Oscar Wilde
"  ""But thou (though Pallas urged thy frantic deed),  Whose spear ill-fated makes a goddess bleed,  Know thou, whoe'er with heavenly power contends,  Short is his date, and soon his glory ends;  From fields of death when late he shall retire,  No infant on his knees shall call him sire.  Strong as thou art, some god may yet be found,  To stretch thee pale and gasping on the ground;  Thy distant wife, Ćgiale the fair,(151)  Starting from sleep with a distracted air,  Shall rouse thy slaves, and her lost lord deplore,  The brave, the great, the glorious now no more!""",The Iliad by Homer
"  Encouraged thus, the blameless man replies:  ""Nor vows unpaid, nor slighted sacrifice,  But he, our chief, provoked the raging pest,  Apollo's vengeance for his injured priest.  Nor will the god's awaken'd fury cease,  But plagues shall spread, and funeral fires increase,  Till the great king, without a ransom paid,  To her own Chrysa send the black-eyed maid.(54)  Perhaps, with added sacrifice and prayer,  The priest may pardon, and the god may spare.""",The Iliad by Homer
—Eh? You bloody old Roman empire? Myles Crawford said.,Ulysses by James Joyce
"  The king of men, on public counsels bent,  Convened the princes in his ample tent,  Each seized a portion of the kingly feast,  But stay'd his hand when thirst and hunger ceased.  Then Nestor spoke, for wisdom long approved,  And slowly rising, thus the council moved.",The Iliad by Homer
—Freeman!,Ulysses by James Joyce
"  ""What hast thou ask'd? ah, why should Jove engage  In foreign contests and domestic rage,  The gods' complaints, and Juno's fierce alarms,  While I, too partial, aid the Trojan arms?  Go, lest the haughty partner of my sway  With jealous eyes thy close access survey;  But part in peace, secure thy prayer is sped:  Witness the sacred honours of our head,  The nod that ratifies the will divine,  The faithful, fix'd, irrevocable sign;  This seals thy suit, and this fulfils thy vows--""  He spoke, and awful bends his sable brows,(70)  Shakes his ambrosial curls, and gives the nod,  The stamp of fate and sanction of the god:  High heaven with trembling the dread signal took,  And all Olympus to the centre shook.(71)",The Iliad by Homer
"The dogs, instead of eating, kept barking at the stranger, according totheir usual habit. Whereupon Homer addressed Glaucus thus: O Glaucus, myfriend, prythee attend to my behest. First give the dogs their supper atthe doors of the hut: for so it is better, since, whilst they watch, northief nor wild beast will approach the fold.
Glaucus was pleased with the advice, and marvelled at its author. Havingfinished supper, they banqueted(10) afresh on conversation, Homernarrating his wanderings, and telling of the cities he had visited.
At length they retired to rest; but on the following morning, Glaucusresolved to go to his master, and acquaint him with his meeting withHomer. Having left the goats in charge of a fellow-servant, he left Homerat home, promising to return quickly. Having arrived at Bolissus, a placenear the farm, and finding his mate, he told him the whole storyrespecting Homer and his journey. He paid little attention to what hesaid, and blamed Glaucus for his stupidity in taking in and feeding maimedand enfeebled persons. However, he bade him bring the stranger to him.
Glaucus told Homer what had taken place, and bade him follow him, assuringhim that good fortune would be the result. Conversation soon showed thatthe stranger was a man of much cleverness and general knowledge, and theChian persuaded him to remain, and to undertake the charge of hischildren.(11)
Besides the satisfaction of driving the impostor Thestorides from theisland, Homer enjoyed considerable success as a teacher. In the town ofChios he established a school where he taught the precepts of poetry. Tothis day,"" says Chandler,(12) ""the most curious remain is that which hasbeen named, without reason, the School of Homer. It is on the coast, atsome distance from the city, northward, and appears to have been an opentemple of Cybele, formed on the top of a rock. The shape is oval, and inthe centre is the image of the goddess, the head and an arm wanting. Sheis represented, as usual, sitting. The chair has a lion carved on eachside, and on the back. The area is bounded by a low rim, or seat, andabout five yards over. The whole is hewn out of the mountain, is rude,indistinct, and probably of the most remote antiquity.""",The Iliad by Homer
Martin Cunningham nudged Mr Power.,Ulysses by James Joyce
Just that moment I was thinking.,Ulysses by James Joyce
"As he closed the door behind him, Dorian Gray touched the bell, and ina few minutes Victor appeared with the lamps and drew the blinds down.He waited impatiently for him to go.  The man seemed to take aninterminable time over everything.",The Picture of Dorian Gray by Oscar Wilde
"Mr. Hallward, sir.  He stayed here till eleven, and then he went awayto catch his train.",The Picture of Dorian Gray by Oscar Wilde
"—He is sitting with Tim Healy, J. J. O’Molloy said, rumour has it,on the Trinity college estates commission.",Ulysses by James Joyce
"Thus on whatever side we contemplate Homer, what principally strikes us ishis invention. It is that which forms the character of each part of hiswork; and accordingly we find it to have made his fable more extensive andcopious than any other, his manners more lively and strongly marked, hisspeeches more affecting and transported, his sentiments more warm andsublime, his images and descriptions more full and animated, hisexpression more raised and daring, and his numbers more rapid and various.I hope, in what has been said of Virgil, with regard to any of theseheads, I have no way derogated from his character. Nothing is more absurdor endless, than the common method of comparing eminent writers by anopposition of particular passages in them, and forming a judgment fromthence of their merit upon the whole. We ought to have a certain knowledgeof the principal character and distinguishing excellence of each: it is inthat we are to consider him, and in proportion to his degree in that weare to admire him. No author or man ever excelled all the world in morethan one faculty; and as Homer has done this in invention, Virgil has injudgment. Not that we are to think that Homer wanted judgment, becauseVirgil had it in a more eminent degree; or that Virgil wanted invention,because Homer possessed a larger share of it; each of these great authorshad more of both than perhaps any man besides, and are only said to haveless in comparison with one another. Homer was the greater genius, Virgilthe better artist. In one we most admire the man, in the other the work.Homer hurries and transports us with a commanding impetuosity; Virgilleads us with an attractive majesty; Homer scatters with a generousprofusion; Virgil bestows with a careful magnificence; Homer, like theNile, pours out his riches with a boundless overflow; Virgil, like a riverin its banks, with a gentle and constant stream. When we behold theirbattles, methinks the two poets resemble the heroes they celebrate. Homer,boundless and resistless as Achilles, bears all before him, and shinesmore and more as the tumult increases; Virgil, calmly daring, like Ćneas,appears undisturbed in the midst of the action; disposes all about him,and conquers with tranquillity. And when we look upon their machines,Homer seems like his own Jupiter in his terrors, shaking Olympus,scattering the lightnings, and firing the heavens: Virgil, like the samepower in his benevolence, counselling with the gods, laying plans forempires, and regularly ordering his whole creation.",The Iliad by Homer
"—Yes, Mr Bloom said. They were both on the way to the boat and hetried to drown.....",Ulysses by James Joyce
"  The forces last in fair array succeed,  Which blameless Glaucus and Sarpedon lead  The warlike bands that distant Lycia yields,  Where gulfy Xanthus foams along the fields.",The Iliad by Homer
"  ""Ye generous chiefs! on whom the immortals lay  The cares and glories of this doubtful day;  On whom your aids, your country's hopes depend;  Wise to consult, and active to defend!  Here, at our gates, your brave efforts unite,  Turn back the routed, and forbid the flight,  Ere yet their wives' soft arms the cowards gain,  The sport and insult of the hostile train.  When your commands have hearten'd every band,  Ourselves, here fix'd, will make the dangerous stand;  Press'd as we are, and sore of former fight,  These straits demand our last remains of might.  Meanwhile thou, Hector, to the town retire,  And teach our mother what the gods require:  Direct the queen to lead the assembled train  Of Troy's chief matrons to Minerva's fane;(166)  Unbar the sacred gates, and seek the power,  With offer'd vows, in Ilion's topmost tower.  The largest mantle her rich wardrobes hold,  Most prized for art, and labour'd o'er with gold,  Before the goddess' honour'd knees be spread,  And twelve young heifers to her altars led:  If so the power, atoned by fervent prayer,  Our wives, our infants, and our city spare,  And far avert Tydides' wasteful ire,  That mows whole troops, and makes all Troy retire;  Not thus Achilles taught our hosts to dread,  Sprung though he was from more than mortal bed;  Not thus resistless ruled the stream of fight,  In rage unbounded, and unmatch'd in might.""",The Iliad by Homer
